{"approval_discovery":{"filename_pattern":"^lovable-toc-operator-identity-recovery-approval-([0-9a-f]{40})-[0-9a-f]{16}[.]json$","home_resolution":"passwd_database_effective_uid","relative_parent":"Library/Application Support/focus-flow-score/migration-approvals/toc-operator-identity-recovery","required_file_mode":"0400","required_file_nlink":1,"required_parent_mode":"0700","selection":"exactly_one_matching_current_checkout"},"artifact_kind":"lovable_toc_operator_identity_recovery_profile","audit_storage":{"initially_empty":true,"no_replace":true,"required_file_mode":"0400","required_file_nlink":1,"required_root_mode":"0700","root_supplied_by_approval":true,"sync_files_and_directories":true},"checkout_policy":{"approval_source":"separate_external_owner_private_artifact","mode":"exact_checkout","same_uid_prelaunch_replacement_ceiling":true},"format_version":1,"procedure_identity_formula":{"algorithm":"sha256_canonical_json_lf","files":["scripts/migration/author-lovable-toc-annotations.py","scripts/migration/author-lovable-toc-operator-session.py","scripts/migration/lib/lovable_toc_authoring_contract.py","scripts/migration/lib/lovable_toc_contract.py","scripts/migration/lib/lovable_toc_operator_identity_recovery.py","scripts/migration/lib/lovable_toc_operator_preflight.py","scripts/migration/recover-lovable-toc-operator-identity.py","scripts/migration/run-lovable-toc-annotation-authoring.sh","scripts/migration/run-lovable-toc-annotation-operator-session.sh","scripts/migration/run-lovable-toc-operator-identity-recovery.sh","scripts/migration/verification/lovable-toc-annotation-checkpoint.schema.json","scripts/migration/verification/lovable-toc-operator-execution-profile-approval.schema.json","scripts/migration/verification/lovable-toc-operator-execution-profile.schema.json","scripts/migration/verification/lovable-toc-operator-execution-profile.v1.json","scripts/migration/verification/lovable-toc-operator-identity-recovery-approval.schema.json","scripts/migration/verification/lovable-toc-operator-identity-recovery-audit-record.schema.json","scripts/migration/verification/lovable-toc-operator-identity-recovery-profile.schema.json","scripts/migration/verification/lovable-toc-operator-identity-recovery-profile.v1.json","scripts/migration/verification/lovable-toc-operator-session-authorization.schema.json","scripts/migration/verification/lovable-toc-operator-session-resume.schema.json"],"include_execution_checkout_sha":true},"prohibited_effects":["annotation_decision_mutation","authoring_action_dispatch","automatic_identity_derivation","capture_package_access","checkpoint_mutation","database_access","identity_rotation","network_access","private_access_before_recovery_authorization","raw_toc_access","restore_command_generation","resume_mutation","root_authorization_mutation","runtime_access","validator_invocation"],"python_policy":{"absolute_path":"/Library/Developer/CommandLineTools/Library/Frameworks/Python3.framework/Versions/3.9/bin/python3.9","exact_gid":0,"exact_mode":"0755","exact_nlink":1,"exact_uid":0,"executable_required":true,"isolated_flags":["-I","-S","-B"],"reported_version":"cpython:3.9.6","sha256":"4b42b1a117605cafc8607b67b0892a609c2cd125012dd56288abeed8c89cdfb1","symlink_components_forbidden":true},"record_versions":{"checkpoint":[1],"resume":[2],"root_authorization":[1]},"recovery_contract":{"allowed_disclosure":"stored_primary_operator_identity_only","audit_events":["attempt_started","identity_acknowledged","recovery_completed","recovery_failed","recovery_indeterminate"],"challenge_phrase_prefix":"AUTHORIZE RECOVER_OPERATOR_IDENTITY","expected_generation":1,"expected_state":"PRIMARY_REVIEW_REQUIRED","historical_binding":{"authoring_procedure_identity_sha256":"bc0b990d878db1e2c72bd4ac91314fe32261a454ac38505b7ea6df4af2b5f3d8","execution_checkout_sha":"b1986e4079b52edbb4ef5cd4c56ed4d20af07195","operator_session_procedure_identity_sha256":"ee0dbb3ecb9b469bef49c1fe0305ea60602bbbbaddd2f551a7774dad6cacdc23","python":{"absolute_path":"/Library/Developer/CommandLineTools/Library/Frameworks/Python3.framework/Versions/3.9/bin/python3.9","reported_version":"cpython:3.9.6","sha256":"4b42b1a117605cafc8607b67b0892a609c2cd125012dd56288abeed8c89cdfb1"}},"no_retry_acknowledgement":"NO_RETRY_AFTER_PRIVATE_ACCESS","operator_root_mutation":"temporary_lock_lifecycle_only","ordinary_action_dispatched":false},"repository":{"name":"focus-flow-score","owner":"starstruck86"},"reviewed_files":["scripts/migration/author-lovable-toc-annotations.py","scripts/migration/author-lovable-toc-operator-session.py","scripts/migration/lib/lovable_toc_authoring_contract.py","scripts/migration/lib/lovable_toc_contract.py","scripts/migration/lib/lovable_toc_operator_identity_recovery.py","scripts/migration/lib/lovable_toc_operator_preflight.py","scripts/migration/recover-lovable-toc-operator-identity.py","scripts/migration/run-lovable-toc-annotation-authoring.sh","scripts/migration/run-lovable-toc-annotation-operator-session.sh","scripts/migration/run-lovable-toc-operator-identity-recovery.sh","scripts/migration/verification/lovable-toc-annotation-checkpoint.schema.json","scripts/migration/verification/lovable-toc-operator-execution-profile-approval.schema.json","scripts/migration/verification/lovable-toc-operator-execution-profile.schema.json","scripts/migration/verification/lovable-toc-operator-execution-profile.v1.json","scripts/migration/verification/lovable-toc-operator-identity-recovery-approval.schema.json","scripts/migration/verification/lovable-toc-operator-identity-recovery-audit-record.schema.json","scripts/migration/verification/lovable-toc-operator-identity-recovery-profile.schema.json","scripts/migration/verification/lovable-toc-operator-identity-recovery-profile.v1.json","scripts/migration/verification/lovable-toc-operator-session-authorization.schema.json","scripts/migration/verification/lovable-toc-operator-session-resume.schema.json"],"verification_labels":["checkout_verified","operator_execution_approval_verified","python_verified","recovery_approval_verified","recovery_procedure_verified","repository_verified","reviewed_files_verified","tty_verified"]}
